{
  "$schema": "https://json-schema.org/draft/2020-12/schema",
  "$id": "https://raw.githubusercontent.com/qingshanblue/qings-pi-modes/main/schemas/permission-mode.schema.json",
  "title": "permission-mode configuration",
  "description": "Declarative permission modes for the pi coding agent. Global config has full authority; project config (.pi/permission-mode.json) is tighten-only.",
  "type": "object",
  "additionalProperties": false,
  "properties": {
    "$schema": { "type": "string" },
    "$comment": {
      "type": "string",
      "description": "Free-form note, ignored by the loader. /permission init writes the copy's provenance here."
    },
    "acknowledgeDefaults": {
      "type": "string",
      "description": "Extension version whose stock defaults you reviewed this file against. Silences 'outdated default' warnings until the shipped defaults change again. Global config only."
    },
    "defaultMode": {
      "type": "string",
      "description": "Name of the mode a new session starts in."
    },
    "cycleOrder": {
      "type": "array",
      "description": "Order modes are cycled with alt+m; also the display order.",
      "items": { "type": "string" }
    },
    "sandbox": {
      "$ref": "#/$defs/sandbox",
      "description": "The shared OS-sandbox profile (allowWrite / denyRead / network / …). Global-only authority; a project may only tighten it. `enabled`/`writable` here are the legacy defaults; the live state is the `alt+s` toggle (\"off\" | \"on\" | \"strict\"), which a mode may pin via `sandboxPin` (no built-in mode does)."
    },
    "network": {
      "type": "object",
      "additionalProperties": false,
      "description": "The network boundary — an independent axis (alt+n toggles it for the session). The filter is the sandbox runtime's proxy, so it applies while the sandbox is not `off`; `free` widens the proxy's allowlist rather than removing the boundary.",
      "properties": {
        "allowedDomains": { "type": "array", "items": { "type": "string" } },
        "deniedDomains": { "type": "array", "items": { "type": "string" } },
        "askOnBlockedHost": { "type": "boolean", "description": "Ask the user live when bash reaches a host outside the allowlist (default true). false = silent deny. Projects may set false, never true." }
      }
    },
    "statusFormat": {
      "enum": ["compact", "verbose"],
      "description": "Footer status style: `compact` (default, a short token line such as \"Auto box:on net:limit AI:inherit\") or `verbose` (the spelled-out form)."
    },
    "outsideWriteRoots": {
      "type": "array",
      "items": { "type": "string" },
      "description": "Extra directories where file-tool write/edit is allowed without a prompt (static, human-chosen; the AI is not consulted). Global config only. Protected paths stay blocked."
    },
    "modes": {
      "type": "object",
      "description": "Map of mode name → mode definition.",
      "additionalProperties": { "$ref": "#/$defs/mode" }
    },
    "plan": {
      "type": "object",
      "additionalProperties": false,
      "description": "One-step plan approval (the Accept / Decline prompt after show_plan, the confirm on switching to the approve mode, /plan approve). Global config only.",
      "properties": {
        "approveMode": { "type": "string", "description": "Mode to switch to when a plan is accepted. Default: edits." },
        "approveMessage": { "type": "string", "description": "User message that starts the implementing turn; {path} is replaced by the plan path. Default: The plan in `{path}` is approved. Implement it now." }
      }
    },
    "classifier": {
      "type": "object",
      "additionalProperties": false,
      "description": "AI safety classifier (used by modes with `classifier: true`). Global config only; reviewer settings cannot be set by a project. The model defaults to the active session model.",
      "properties": {
        "enabled": { "type": "boolean", "description": "Master switch for the classifier (default true)." },
        "model": { "type": "string", "description": "\"current\" (default) follows the active session model; otherwise a `provider/model` id resolved from the model registry." },
        "timeoutMs": { "type": "integer", "minimum": 1, "description": "Per-call timeout in ms (default 15000)." },
        "failClosed": { "type": "boolean", "description": "true (default): a classifier error blocks the action. false: fall back to the human prompt." },
        "maxConsecutiveDenials": { "type": "integer", "minimum": 0, "description": "Offer the human prompt after this many consecutive denials (default 3; 0 disables)." },
        "maxTokens": { "type": "integer", "minimum": 1, "description": "Answer budget per call (default 700)." },
        "maxInputChars": { "type": "integer", "minimum": 1, "description": "Cap on the action payload sent to the model (default 4000)." }
      }
    }
  },
  "$defs": {
    "action": {
      "enum": ["allow", "ask", "deny"],
      "description": "allow = pass through; ask = prompt; deny = block."
    },
    "surfaceValue": {
      "description": "An action, or a glob pattern→action map (last match wins; '*' is the catch-all).",
      "oneOf": [
        { "$ref": "#/$defs/action" },
        {
          "type": "object",
          "additionalProperties": { "$ref": "#/$defs/action" }
        }
      ]
    },
    "sandbox": {
      "type": "object",
      "additionalProperties": false,
      "description": "OS sandbox profile for the mode.",
      "properties": {
        "enabled": { "type": "boolean", "description": "false = run bash unsandboxed (YOLO-style)." },
        "writable": { "type": "boolean", "description": "false = bash runs read-only (Plan-style)." },
        "askOnBlockedHost": { "type": "boolean", "description": "Ask the user live when bash tries a host outside the allowlist (default true). false = silent deny. Projects may set false, never true." },
        "allowWrite": { "type": "array", "items": { "type": "string" } },
        "denyWrite": { "type": "array", "items": { "type": "string" } },
        "denyRead": { "type": "array", "items": { "type": "string" } },
        "allowRead": { "type": "array", "items": { "type": "string" }, "description": "Paths readable again inside a denyRead region (deny-then-allow). Projects may only remove entries." },
        "network": {
          "type": "object",
          "additionalProperties": false,
          "properties": {
            "allowedDomains": { "type": "array", "items": { "type": "string" } },
            "deniedDomains": { "type": "array", "items": { "type": "string" } }
          }
        }
      }
    },
    "permission": {
      "type": "object",
      "additionalProperties": false,
      "description": "Per-surface allow/ask/deny policy.",
      "properties": {
        "path": { "$ref": "#/$defs/surfaceValue", "description": "Cross-cutting gate over ALL file access; a deny here overrides per-tool allows." },
        "external_directory": { "$ref": "#/$defs/surfaceValue", "description": "Access to paths outside the project." },
        "read": { "$ref": "#/$defs/surfaceValue" },
        "write": { "$ref": "#/$defs/surfaceValue" },
        "edit": { "$ref": "#/$defs/surfaceValue" },
        "grep": { "$ref": "#/$defs/surfaceValue" },
        "find": { "$ref": "#/$defs/surfaceValue" },
        "ls": { "$ref": "#/$defs/surfaceValue" },
        "bash": { "$ref": "#/$defs/surfaceValue", "description": "Matched per extracted command (name + args)." },
        "web_search": { "$ref": "#/$defs/surfaceValue" },
        "tool": { "$ref": "#/$defs/surfaceValue", "description": "Any non-builtin (extension) tool, by name." },
        "skill": { "$ref": "#/$defs/surfaceValue", "description": "Skills, by name (gated at /skill:<name>)." }
      }
    },
    "mode": {
      "type": "object",
      "additionalProperties": false,
      "properties": {
        "label": { "type": "string", "description": "Footer label." },
        "color": { "enum": ["muted", "mdLink", "accent", "error", "warning", "success"], "description": "Footer label color." },
        "systemPrompt": { "type": "string", "description": "System prompt to inject; '@plan' resolves to the dated Plan-mode prompt." },
        "injectSandboxInfo": { "type": "boolean", "description": "Inject the mode's sandbox boundaries (writable paths, denied reads, network allowlist) into the system prompt each turn (default true). Modes with sandbox.enabled:false never inject." },
        "sandbox": { "$ref": "#/$defs/sandbox", "description": "Legacy per-mode sandbox override. Prefer the top-level `sandbox`; kept for backward compatibility." },
        "sandboxPin": { "enum": ["off", "on", "strict"], "description": "Force the sandbox state while this mode is active (overrides the `alt+s` session toggle, restored on leaving). No built-in mode ships one; the stock modes rely on the session state." },
        "permission": { "$ref": "#/$defs/permission" },
        "hideTools": { "type": "array", "items": { "type": "string" }, "description": "Tools hidden from the model in this mode." },
        "bypassProtectedPaths": { "type": "boolean", "description": "Skip the .git/.env/dotfile write backstop (only trusted modes)." },
        "classifier": { "type": "boolean", "description": "Route this mode's `ask` decisions through the AI safety classifier instead of the human prompt (see the top-level `classifier` block)." },
        "aiGatesUnsandboxed": { "type": "boolean", "description": "Let the AI classifier gate bash asks that will run UNSANDBOXED (sandbox off/unavailable) instead of escalating to the human. Factory `auto` sets true; set false to restore human-only unsandboxed asks. Only meaningful with `classifier: true`. Privilege escalation, sandbox-on escapes, and payloads the reviewer cannot fully inspect always go to the human. Default false for custom modes. Global config only." }
      }
    }
  }
}
