{
  "$schema": "./schemas/permission-mode.schema.json",
  "defaultMode": "ask",
  "cycleOrder": [
    "plan",
    "ask",
    "edits",
    "auto",
    "accept"
  ],
  "sandbox": {
    "enabled": true,
    "writable": true,
    "allowWrite": [
      ".",
      "/tmp/pi"
    ],
    "denyWrite": [],
    "denyRead": [
      "~/.ssh",
      "~/.aws",
      "~/.gnupg",
      "~/.netrc",
      "~/.git-credentials",
      "~/.pypirc",
      "~/.gem/credentials",
      "~/.vault-token",
      "~/.password-store",
      "~/.pi/agent/auth.json",
      "~/.pi/agent/oauth.json"
    ]
  },
  "network": {
    "allowedDomains": [
      "npmjs.org",
      "*.npmjs.org",
      "registry.npmjs.org",
      "registry.yarnpkg.com",
      "pypi.org",
      "*.pypi.org",
      "github.com",
      "*.github.com",
      "api.github.com",
      "raw.githubusercontent.com"
    ],
    "deniedDomains": []
  },
  "modes": {
    "ask": {
      "label": "Ask",
      "color": "muted",
      "permission": {
        "path": {
          "*": "allow"
        },
        "external_directory": "ask",
        "read": "allow",
        "grep": "allow",
        "find": "allow",
        "ls": "allow",
        "write": "ask",
        "edit": "ask",
        "bash": {
          "*": "ask"
        },
        "web_search": "ask",
        "tool": "ask",
        "skill": "ask"
      }
    },
    "plan": {
      "label": "Plan Mode",
      "color": "mdLink",
      "systemPrompt": "@plan",
      "permission": {
        "path": {
          "*": "allow"
        },
        "external_directory": "ask",
        "read": "allow",
        "grep": "allow",
        "find": "allow",
        "ls": "allow",
        "write": {
          "*": "deny",
          "*.md": "allow",
          "*.markdown": "allow"
        },
        "edit": {
          "*": "deny",
          "*.md": "allow",
          "*.markdown": "allow"
        },
        "bash": {
          "*": "ask"
        },
        "web_search": "allow",
        "tool": "ask",
        "skill": "ask"
      }
    },
    "auto": {
      "label": "Auto",
      "color": "warning",
      "classifier": true,
      "systemPrompt": "Auto mode is active: risky actions (writes, non-read bash, out-of-project access, extension tools) are reviewed by an AI safety classifier instead of prompting the human every time. Keep actions scoped to the project, reversible, and aligned with the request; secret access, privilege escalation, and data exfiltration are blocked.",
      "permission": {
        "path": {
          "*": "allow"
        },
        "external_directory": "ask",
        "read": "allow",
        "grep": "allow",
        "find": "allow",
        "ls": "allow",
        "write": "ask",
        "edit": "ask",
        "bash": {
          "*": "ask"
        },
        "web_search": "ask",
        "tool": "ask",
        "skill": "ask"
      }
    },
    "edits": {
      "label": "Edits",
      "color": "accent",
      "permission": {
        "path": {
          "*": "allow"
        },
        "external_directory": "ask",
        "read": "allow",
        "grep": "allow",
        "find": "allow",
        "ls": "allow",
        "write": "allow",
        "edit": "allow",
        "bash": {
          "*": "ask"
        },
        "web_search": "ask",
        "tool": "ask",
        "skill": "ask"
      }
    },
    "accept": {
      "label": "Accept",
      "color": "error",
      "bypassProtectedPaths": true,
      "permission": {
        "path": {
          "*": "allow"
        },
        "external_directory": "allow",
        "read": "allow",
        "write": "allow",
        "edit": "allow",
        "grep": "allow",
        "find": "allow",
        "ls": "allow",
        "bash": {
          "*": "allow"
        },
        "web_search": "allow",
        "tool": "allow",
        "skill": "allow"
      }
    }
  }
}
